<?xml version="1.0" encoding="UTF-8"?>
<sa:Saglasnost xmlns:sa="http:///www.ftn.uns.ac.rs/vakcinacija/saglasnost"
    xmlns:ct="http:///www.ftn.uns.ac.rs/vakcinacija/commonTypes" xmlns:xsi="http://www.w3.org/2001/XMLSchema-instance" 
    xsi:schemaLocation="http:///www.ftn.uns.ac.rs/vakcinacija/saglasnost ../xsd/saglasnost.xsd">
    <sa:PacijentSaglasnost>
        <sa:LicneInformacije>
            <sa:Drzavljanstvo>
                <sa:RepublikaSrbija>
                    <sa:JMBG>3344324343444</sa:JMBG>
                </sa:RepublikaSrbija>
            </sa:Drzavljanstvo>
            <sa:PunoIme>
                <ct:Ime>Petar</ct:Ime>
                <ct:Prezime>Markovic</ct:Prezime>
            </sa:PunoIme>
            <sa:ImeRoditelja>Petar</sa:ImeRoditelja>
            <sa:Pol>Muski</sa:Pol>
            <sa:DatumRodjenja>1999-07-10</sa:DatumRodjenja>
            <sa:MestoRodjenja>NS</sa:MestoRodjenja>
            <sa:Adresa>Adresa</sa:Adresa>
            <sa:Mesto>Mesto</sa:Mesto>
            <sa:Opstina>NS</sa:Opstina>
            <sa:BrojFiksnogTelefona>015421442</sa:BrojFiksnogTelefona>
            <sa:BrojMobilnogTelefona>0603234353</sa:BrojMobilnogTelefona>
            <sa:Email>test@gmail.com</sa:Email>
            <sa:RadniStatus>Student</sa:RadniStatus>
        </sa:LicneInformacije>
        <sa:Imunizacija>
            <sa:NazivImunoloskogLeka>Lek</sa:NazivImunoloskogLeka>
        </sa:Imunizacija>
    </sa:PacijentSaglasnost>
    <sa:ZdravstveniRadnikSaglasnost>
        <sa:ZdravstvenaUstanova>Ustanova</sa:ZdravstvenaUstanova>
        <sa:VakcinacijskiPunkt>Punkt</sa:VakcinacijskiPunkt>
        <sa:LicneInformacijeLekara>
            <sa:PunoIme>
                <ct:Ime>Petar</ct:Ime>
                <ct:Prezime>Markovic</ct:Prezime>
            </sa:PunoIme>
            <sa:BrojTelefona>0603535255</sa:BrojTelefona>
        </sa:LicneInformacijeLekara>
        <sa:Obrazac>
            <sa:VakcineInfo>
                <sa:NazivVakcine>Pfizer-BioNTech</sa:NazivVakcine>
                <sa:DatumDavanjaVakcine>2021-03-10</sa:DatumDavanjaVakcine>
                <sa:NacinDavanjeVakcine/>
                <sa:Ekstremitet>DR</sa:Ekstremitet>
                <sa:SerijaVakcine>Prva</sa:SerijaVakcine>
                <sa:Proizvodjac>Pfizer-BioNTech</sa:Proizvodjac>
                <sa:NezeljanaReakcija>random</sa:NezeljanaReakcija>
                <sa:NazivVakcine>Pfizer-BioNTech</sa:NazivVakcine>
                <sa:DatumDavanjaVakcine>2021-03-10</sa:DatumDavanjaVakcine>
                <sa:NacinDavanjeVakcine/>
                <sa:Ekstremitet>DR</sa:Ekstremitet>
                <sa:SerijaVakcine>Prva</sa:SerijaVakcine>
                <sa:Proizvodjac>Pfizer-BioNTech</sa:Proizvodjac>
                <sa:NezeljanaReakcija>random</sa:NezeljanaReakcija>
            </sa:VakcineInfo>
            <sa:PrivremeneKontraindikacije>
                <sa:DatumUtvrdjivanja>2021-03-12</sa:DatumUtvrdjivanja>
                <sa:Dijagnoza>dijagnoza</sa:Dijagnoza>
            </sa:PrivremeneKontraindikacije>
            <sa:TrajneKontraindikacije>asdf</sa:TrajneKontraindikacije>
        </sa:Obrazac>
    </sa:ZdravstveniRadnikSaglasnost>
</sa:Saglasnost>